{
  "$schema": "http://json-schema.org/draft-07/schema#",
  "type": "object",
  "properties": {
    "action": { "type": "string" },
    "issue": {
      "type": "object",
      "properties": {
        "number": { "type": "integer" },
        "title":  { "type": "string" },
        "state":  { "type": "string" },
        "body":   { "type": ["string", "null"] },
        "user":   { "type": "object", "properties": { "login": { "type": "string" } }, "additionalProperties": true },
        "labels": { "type": "array", "items": { "type": "object", "additionalProperties": true } }
      },
      "additionalProperties": true
    },
    "comment": {
      "type": "object",
      "properties": {
        "id":   { "type": "integer" },
        "body": { "type": "string" },
        "user": { "type": "object", "properties": { "login": { "type": "string" } }, "additionalProperties": true }
      },
      "additionalProperties": true
    },
    "repository": {
      "type": "object",
      "properties": { "full_name": { "type": "string" } },
      "additionalProperties": true
    },
    "sender": { "type": "object", "additionalProperties": true }
  },
  "additionalProperties": true
}
